{
  "schema": "io.navocms.r2-runtime-binding.v1",
  "tenantId": "11111111-1111-4111-8111-111111111111",
  "siteId": "22222222-2222-4222-8222-222222222222",
  "environment": "staging",
  "endpoint": "https://account.r2.cloudflarestorage.com",
  "bucket": "navocms-staging-media",
  "namespace": "navocms/v1/",
  "accessKeySecretRef": "secret:r2/access-key",
  "secretKeySecretRef": "secret:r2/secret-key"
}
